{
  "data_mundo": "0423-07-27",
  "local_atual": "sharia",
  "clima": "fim de verão, ar seco, céu limpo",
  "relogios": {
    "descida": 0,
    "coroa_silenciosa": 0,
    "purificacao": 0,
    "titulo_vago": 0,
    "migracao": 0
  },
  "flags": [
    "apagou_mapa_da_parede",
    "cobriu_pegadas_quarto",
    "garrow_desconfia_sumico_elias",
    "leu_caderno_elias",
    "pahl_chamou_dunmorrow",
    "terceiro_registro_mes",
    "praticando_conjuracao_sem_palavras",
    "reencontrou_elias_ala_leste",
    "theo_retido_ala_leste_observacao",
    "dunmorrow_sabe_que_theo_mentiu",
    "corin_avisou_nao_beber",
    "dunmorrow_viu_theo_desenhar_dormindo",
    "viu_holm_cochilar_elias_quase_esvaziado",
    "elias_levado_terceira_dose",
    "janela_sala_observacao_rachada",
    "corin_confessou_carregar_elias",
    "theo_sonambulo_com_giz_papeis_dunmorrow",
    "elias_dorme_desde_terceira_dose",
    "janela_tabuada",
    "resgatado_por_anwen_tal",
    "anwen_recuperou_caderno",
    "audiencia_fenwick_0423_07_28",
    "plano_porao_noite_27",
    "entrou_no_porao_dunmorrow",
    "tobb_estabilizado_inconsciente",
    "pegou_cadernos_dunmorrow",
    "corin_viu_fuga_e_deixou_passar",
    "leu_caderno_theo_dunmorrow",
    "penhorista_avisa_dunmorrow",
    "dunmorrow_planeja_dose_theo_0423_07_30"
  ],
  "noticias_recentes": [],
  "sessao": 1,
  "abertura": "estudante"
}
